{
  "schema_version": 2,
  "registry_version": "0.2.0",
  "last_updated": "2026-10-19",
  "purpose": "research_only",
  "entries": [
    {
      "id": "openai-chatgpt",
      "provider": {
        "id": "openai",
        "name": "OpenAI"
      },
      "product": "ChatGPT",
      "categories": [
        "hosted_chat",
        "multimodal"
      ],
      "surfaces": [
        "web",
        "desktop"
      ],
      "status": "observed",
      "sources": [
        {
          "id": "source-1",
          "url": "https://chatgpt.com/",
          "checked_on": "2026-10-19",
          "indicator_assessment": "`chatgpt.com` exact host; identifies service surface, not user intent."
        }
      ],
      "indicators": [
        {
          "kind": "domain_exact",
          "value": "chatgpt.com",
          "scope": "Hosted ChatGPT web product hostname",
          "source_id": "source-1",
          "limitations": "`chatgpt.com` exact host; identifies service surface, not user intent."
        }
      ],
      "relationships": []
    },
    {
      "id": "anthropic-claude",
      "provider": {
        "id": "anthropic",
        "name": "Anthropic"
      },
      "product": "Claude",
      "categories": [
        "hosted_chat",
        "multimodal"
      ],
      "surfaces": [
        "web",
        "desktop"
      ],
      "status": "observed",
      "sources": [
        {
          "id": "source-1",
          "url": "https://claude.ai/",
          "checked_on": "2026-10-19",
          "indicator_assessment": "`claude.ai` exact host; API and other clients are separate."
        }
      ],
      "indicators": [
        {
          "kind": "domain_exact",
          "value": "claude.ai",
          "scope": "Hosted Claude web product hostname",
          "source_id": "source-1",
          "limitations": "`claude.ai` exact host; API and other clients are separate."
        }
      ],
      "relationships": []
    },
    {
      "id": "google-gemini",
      "provider": {
        "id": "google",
        "name": "Google"
      },
      "product": "Gemini",
      "categories": [
        "hosted_chat",
        "multimodal",
        "search_research"
      ],
      "surfaces": [
        "web",
        "mobile"
      ],
      "status": "observed",
      "sources": [
        {
          "id": "source-1",
          "url": "https://gemini.google.com/",
          "checked_on": "2026-10-19",
          "indicator_assessment": "`gemini.google.com` exact host; shared Google services remain outside this match."
        }
      ],
      "indicators": [
        {
          "kind": "domain_exact",
          "value": "gemini.google.com",
          "scope": "Hosted Gemini web product hostname",
          "source_id": "source-1",
          "limitations": "`gemini.google.com` exact host; shared Google services remain outside this match."
        }
      ],
      "relationships": []
    },
    {
      "id": "xai-grok",
      "provider": {
        "id": "xai",
        "name": "xAI"
      },
      "product": "Grok",
      "categories": [
        "hosted_chat",
        "multimodal",
        "search_research"
      ],
      "surfaces": [
        "web",
        "mobile"
      ],
      "status": "observed",
      "sources": [
        {
          "id": "source-1",
          "url": "https://grok.com/",
          "checked_on": "2026-10-19",
          "indicator_assessment": "`grok.com` exact host for this consumer surface; API is separate."
        }
      ],
      "indicators": [
        {
          "kind": "domain_exact",
          "value": "grok.com",
          "scope": "Hosted Grok consumer product hostname",
          "source_id": "source-1",
          "limitations": "`grok.com` exact host for this consumer surface; API is separate."
        }
      ],
      "relationships": []
    },
    {
      "id": "deepseek-chat",
      "provider": {
        "id": "deepseek",
        "name": "DeepSeek"
      },
      "product": "Chat",
      "categories": [
        "hosted_chat",
        "multimodal"
      ],
      "surfaces": [
        "web",
        "mobile"
      ],
      "status": "observed",
      "sources": [
        {
          "id": "source-1",
          "url": "https://chat.deepseek.com/",
          "checked_on": "2026-10-19",
          "indicator_assessment": "`chat.deepseek.com` exact host; does not cover API/gateway use."
        }
      ],
      "indicators": [
        {
          "kind": "domain_exact",
          "value": "chat.deepseek.com",
          "scope": "Hosted DeepSeek Chat product hostname",
          "source_id": "source-1",
          "limitations": "`chat.deepseek.com` exact host; does not cover API/gateway use."
        }
      ],
      "relationships": []
    },
    {
      "id": "moonshot-ai-kimi",
      "provider": {
        "id": "moonshot-ai",
        "name": "Moonshot AI"
      },
      "product": "Kimi",
      "categories": [
        "hosted_chat",
        "search_research",
        "multimodal"
      ],
      "surfaces": [
        "web",
        "mobile"
      ],
      "status": "observed",
      "sources": [
        {
          "id": "source-1",
          "url": "https://www.kimi.com/en/",
          "checked_on": "2026-10-19",
          "indicator_assessment": "`kimi.com` exact host for the product; regional and API surfaces may differ."
        }
      ],
      "indicators": [
        {
          "kind": "domain_exact",
          "value": "kimi.com",
          "scope": "Hosted Kimi product hostname",
          "source_id": "source-1",
          "limitations": "`kimi.com` exact host for the product; regional and API surfaces may differ."
        }
      ],
      "relationships": []
    },
    {
      "id": "alibaba-qwen-chat",
      "provider": {
        "id": "alibaba",
        "name": "Alibaba"
      },
      "product": "Qwen Chat",
      "categories": [
        "hosted_chat",
        "multimodal"
      ],
      "surfaces": [
        "web",
        "mobile"
      ],
      "status": "observed",
      "sources": [
        {
          "id": "source-1",
          "url": "https://chat.qwen.ai/",
          "checked_on": "2026-10-19",
          "indicator_assessment": "`chat.qwen.ai` exact host; Alibaba also offers regional cloud APIs."
        }
      ],
      "indicators": [
        {
          "kind": "domain_exact",
          "value": "chat.qwen.ai",
          "scope": "Hosted Qwen Chat product hostname",
          "source_id": "source-1",
          "limitations": "`chat.qwen.ai` exact host; Alibaba also offers regional cloud APIs."
        }
      ],
      "relationships": []
    },
    {
      "id": "mistral-le-chat",
      "provider": {
        "id": "mistral-ai",
        "name": "Mistral AI"
      },
      "product": "Vibe (formerly Le Chat)",
      "categories": [
        "hosted_chat",
        "multimodal",
        "search_research"
      ],
      "surfaces": [
        "web",
        "mobile"
      ],
      "status": "observed",
      "sources": [
        {
          "id": "source-1",
          "url": "https://mistral.ai/products/vibe/",
          "checked_on": "2026-10-19",
          "indicator_assessment": "`chat.mistral.ai` is the product host; the product page now brands the experience Vibe and says it was formerly Le Chat. This does not identify API use or intent."
        }
      ],
      "indicators": [
        {
          "kind": "domain_exact",
          "value": "chat.mistral.ai",
          "scope": "Hosted Mistral Vibe/Le Chat product hostname",
          "source_id": "source-1",
          "limitations": "`chat.mistral.ai` is the product host; the product page now brands the experience Vibe and says it was formerly Le Chat. This does not identify API use or intent."
        }
      ],
      "relationships": []
    },
    {
      "id": "meta-meta-ai",
      "provider": {
        "id": "meta",
        "name": "Meta"
      },
      "product": "Meta AI",
      "categories": [
        "hosted_chat",
        "multimodal"
      ],
      "surfaces": [
        "web",
        "mobile"
      ],
      "status": "observed",
      "sources": [
        {
          "id": "source-1",
          "url": "https://www.meta.ai/",
          "checked_on": "2026-10-19",
          "indicator_assessment": "`meta.ai` exact host; AI features embedded in other Meta apps are separate."
        }
      ],
      "indicators": [
        {
          "kind": "domain_exact",
          "value": "meta.ai",
          "scope": "Hosted Meta AI product hostname",
          "source_id": "source-1",
          "limitations": "`meta.ai` exact host; AI features embedded in other Meta apps are separate."
        }
      ],
      "relationships": []
    },
    {
      "id": "microsoft-copilot",
      "provider": {
        "id": "microsoft",
        "name": "Microsoft"
      },
      "product": "Copilot",
      "categories": [
        "hosted_chat",
        "multimodal",
        "search_research"
      ],
      "surfaces": [
        "web",
        "desktop",
        "mobile"
      ],
      "status": "observed",
      "sources": [
        {
          "id": "source-1",
          "url": "https://copilot.microsoft.com/",
          "checked_on": "2026-10-19",
          "indicator_assessment": "`copilot.microsoft.com` exact host; Copilot is also embedded across Microsoft products."
        }
      ],
      "indicators": [
        {
          "kind": "domain_exact",
          "value": "copilot.microsoft.com",
          "scope": "Hosted Microsoft Copilot product hostname",
          "source_id": "source-1",
          "limitations": "`copilot.microsoft.com` exact host; Copilot is also embedded across Microsoft products."
        }
      ],
      "relationships": []
    },
    {
      "id": "perplexity",
      "provider": {
        "id": "perplexity",
        "name": "Perplexity"
      },
      "product": "Perplexity",
      "categories": [
        "hosted_chat",
        "search_research",
        "multimodal"
      ],
      "surfaces": [
        "web",
        "mobile"